Company,items,industry,description
AJ네트웍스,"렌탈(파렛트, OA장비, 건설장비)",산업용 기계 및 장비 임대업,"기업개요
동사가 영위하는 사업은 렌탈 사업부문, 창고 및 유통부문, 그리고 기타부문으로 구분됨.
렌탈 사업부문에서 취급하는 상품은 파렛트, IT기기, 건설산업장비 등이 있음. 창고 및 유통부문에서는 연결종속회사인 베트남 현지법인 2개사를 통하여 베트남에서 냉장/냉동 창고임대업을 영위하고 있음.
그 외 기타부문에서는 연결종속회사를 통하여 자동차 정비, 부동산 관리업 등을 영위하고 있음.
출처 : 에프앤가이드"
HDC현대산업개발,"외주주택, 자체공사, 일반건축, 토목 등",건물 건설업,"기업개요
동사는 현대산업개발의 사업 중 건설사업, PC사업업, 호텔 및 콘도 사업부문을 인적분할의 방식으로 분할하여 2018년 5월 설립되었음.
종합건설회사인 동사는 도급방식의 건설공사를 수행하고 있을 뿐만 아니라 수익성을 제고시킬 수 있는 개발형 건설 사업까지 아우름.
사업부문은 건설부문(자체공사, 외주주택, 일반건축, 토목 등)와 기타부문( PC사업, 호텔 및 콘도, 주거용건물 개발, 공급)으로 구성됨.
출처 : 에프앤가이드"
HD한국조선해양,"선박,해양구조물,엔진,펌프 전동기,중전기,중장비 제조/자동창고,물류시스템",기타 금융업,"기업개요
동사는 독점규제 및 공정거래에 관한 법률에 따라 설립된 지주회사로서, 지배기업인 동사와 종속기업(20개사)으로 이루어짐.
조선사업은 일반상선, 고부가가치 가스선, 해양관련 선박, 최신예 함정 등의 건조와 수소ㆍ암모니아 추진운반선을 개발하고 있으며, 해양플랜트사업은 원유 생산ㆍ저장설비 공사, 발전ㆍ화공플랜트공사를 수행함.
엔진기계사업은 대형엔진, 중형엔진, 육상용 엔진발전설비 등을 공급하고 있음.
출처 : 에프앤가이드"
KTis,"114전화번호안내, 고객센터",기타 정보 서비스업,"기업개요
당사는 2001년 (주)케이티의 114번호안내서비스 사업이 분사하여 설립되었으며, 컨택센터사업, 광고서비스 상품판매 사업, 유통사업을 주요사업으로 영위하고 있음.
컨택센터사업은 KT고객센터, 114번호안내센터, 일반컨택센터 사업으로 구성되어 있음.
광고서비스상품판매사업은 우선번호안내사업과 그 외 광고상품을 판매하고 있음. 유통사업은 KT통신상품 유통사업과 KT플라자 운영위수탁 사업을 함께 영위하고 있음.
출처 : 에프앤가이드"
LX홀딩스,지주회사,기타 금융업,"기업개요
동사는 인적분할로 설립된 신설회사로 2021년 5월 27일 유가증권시장에 재상장함.
별도사업을 영위하지 않는 순수지주회사의 성격을 취하고 있으며 LX인터내셔널, LX하우시스, LX MMA, LX세미콘의 4개의 국내자회사를 보유함.
각 자회사들은 주요사업으로 상품중개업(LX인터내셔널), 건축용 플라스틱 제품제조업(LX하우시스), 시스템반도체 IC 설계 및 제조업(LX세미콘), 기타 기초유기화합물 제조업(LX MMA)을 영위함.
출처 : 에프앤가이드"
STX,"에너지 원료(석탄,석유),산업기자재(기계부품) 도매",상품 종합 도매업,"기업개요
1976년에 설립된 동사는 에너지, 원자재 수출입, 기계/엔진, 해운/물류의 4대 사업을 중심으로 한 전문 무역상사임.
국내 계열회사로는 STX마린서비스(선박관리, 해양서비스), STX리조트( 리조트, 단체급식), 피케이밸브앤엔지니어링(밸브제조), STX바이오 등이 있음.
2014년 채권단과 경영정상화계획 이행 약정을 체결하였으며, 2018년 8월 채권단 지분매각으로 최대주주가 APC머큐리로 변경, 채권단 공동관리절차 종료됨.
출처 : 에프앤가이드"
국보,"화물자동차운송,콘테이너운송,수출입화물보관,도로운송,CY보관,하역",도로 화물 운송업,"기업개요
동사는 크게 물류사업(컨테이너 화물운송, 보관, 하역 등), 의류사업(골프 의류, 악세사리 도소매 등)을 영위하고 있음.
물류사업 종속기업으로는 케이티엘, 국보네트웍스가 있으며 의류사업으로는 보그인터내셔날이 있음.
매출구성은 물류 60.53%, 골프 의류 도소매 38.96%로 이루어져 있음. 최근 의류 서브 브랜드를 개시해 MZ세대를 겨냥한 다양한 제품을 출시하고 있음.
출처 : 에프앤가이드"
노루페인트,페인트 제조,기타 화학제품 제조업,"기업개요
동사는 주식회사 노루홀딩스에서 2006년 인적분할되어 설립되었고, 도료 제조 및 판매 등의 사업을 승계하였음.
동사가 생산하는 페인트 용도별 시장은 건축용, 공업용, 자동차보수용, 모바일용 등이 있음.
종속회사가 영위하는 사업으로는 PCM강판용 도료제조 및 판매, 도료 제조 및 판매, 도료 무역업, 페인트 및 도장장비 관련 부자재 도소매, 모바일 도료 제조 및 판매, 디자인 리서치 및 컨설팅 등이 있음.
출처 : 에프앤가이드"
대림통상,"수전금구,비데,위생도기,샤워부스,타일,양식기,무역",기타 금속 가공제품 제조업,"기업개요
동사는 수전금구, 비데와 감지기, 샤워부스 및 기타 건자재 등을 생산하여 수출 및 내수 판매하는 건자재 종합 전문기업임.
질, 기능, 디자인등 경쟁력 확보를 하여 품질경쟁력우수기업 23회 선정되었으며, 세계 3대 디자인 어워드에서 수상하는 등 뛰어난 품질 및 디자인으로 인정받음.
주요 고객으로는 한일상사, 진운하우징, Fortessa, Riobel, 쿠팡, 대림, 도비도스 등이 있음.
출처 : 에프앤가이드"
롯데지주,지주회사,기타 금융업,"기업개요
동사의 주요 자회사들이 영위하는 주요 사업으로는 백화점업(롯데쇼핑), 석유화학계 기초 화학물질 제조업(롯데케미칼), 빙과, 제빵 제품 및 건강 기능 식품제조업(롯데제과), 음료제조업(롯데칠성)이 있음.
영업수익은 자회사 및 기타 투자회사로부터의 배당수익, 상표권사용수익, 임대수익 등으로 구성.
동사의 핵심 자회사는 백화점, 할인점 등 유통업을 주력으로 하는 롯데쇼핑, 기초소재와 첨단소재 부문의 등 화학산업을 영위하는 롯데케미칼임.
출처 : 에프앤가이드"
삼부토건,"토목공사,건축공사,포장공사,건설업,분양사업/건설자재 제조",토목 건설업,"기업개요
동사는 국내건설업부문(삼부토건, 삼부르네상스, 삼부르네상스더힐), 해외건설업부문(삼부토건, 삼부파키스탄), 스틸사업부문(삼부토건), 기타사업부문(삼부토건)으로 운영됨.
2022년 도급순위 기준 70위 업체로 75년간의 풍부한 토목시공 경험을 토대로 항만, 댐, 도로, 지하철, 발전소 등에서 기술적 노하우와 시공실적을 보유함.
국내사업 부문에서는 도로공사, 지하철, 철도, 발전소 등의 생산 및 판매 제품이 있음.
출처 : 에프앤가이드"
삼성엔지니어링,"산업설비,건물,구축물,토목시설의 설계,시공,공사감리","건축기술, 엔지니어링 및 관련 기술 서비스업","기업개요
동사는 전 세계 플랜트 시장에서 활발한 사업을 전개하는 글로벌 EPC(설계, 구매, 시공) 전문기업임. 1970년 1월 20일에 설립되어 1996년 12월 24일 유가증권시장에 상장됨.
동사는 전 세계 플랜트 시장에서 플랜트 사업을 전개하고 있으며, 사업부문은 엔지니어링 업무 성격에 따라 화공과 비화공으로 구분하고 있음.
산업환경은 그룹 내 물량의 지속적인 발주가 이어지고, 해외 수처리 및 바이오 시장의 성장이 확대될 전망임.
출처 : 에프앤가이드"
삼익THK,"직선운동시스템,메카트로시스템,기타정밀 자동화기기 제조,판매/전자상거래,인터넷 관련 s/w,h/w 개발,판매,유지보수",일반 목적용 기계 제조업,"기업개요
동사는 수공용 줄을 생산, 판매할 목적으로 1965년 설립되었으며, 이후 기타 기계 및 장비제품의 제조 및 판매 업종을 추가함.
산업설비자동화, 반도체 제조장비 및 시험장비 등에 필수요소 부품인 LM시스템과 LM가이드, 볼스크류, 서브모터, 감속기 등을 조합한 메카트로시스템 사업을 영위함.
동사는 주력품목인 LM시스템의 각종 적용 기술을 별도 기술지원홈페이지를 통하여 자료를 구축 및 고객 지원을 하고 있음.
출처 : 에프앤가이드"
삼호개발,"토공사,철근콘크리트공사,포장공사,미장방수공사,상하수도공사,수중공사,비계구조물해체공사/골재,아스콘 제조,판매,중기임대",기반조성 및 시설물 축조관련 전문공사업,"기업개요
동사의 사업부문은 건설부문과 창업투자부문으로 나뉘고 있음.
고속도로 및 국도 등의 도로공사, 골프장조성공사, 지하철공사 등의 토목공사를 하고있으며, 본점(충남 당진)의 공장에서 골재를 생산, 판매함.
우수한 비지니스 모델을 갖고 있는 중소기업 및 벤처기업에 투자하여 자본, 경영관리, 기술정보, 마케팅 등을 종합적으로 지원함으로써 투자기업가치를 제고한 후 투자지분 처분을 통하여 투자수익을 실현.
출처 : 에프앤가이드"
시디즈,의자,가구 제조업,"기업개요
동사는 2010년 12월 15일에 설립되었으며 의자가구 제조업을 주요 사업으로 영위하고 있음.
생산된 주요 제품 등은 대리점, 백화점, 대형마트, 온라인쇼핑몰, 에이전트 등의 판매 경로를 통하여 국내외로 판매되고 있음.
현재 국내 의자 시장 점유율 및 브랜드 인지도 1위의 기업으로 자리잡았으며, 디자인과 기술력으로 차별화된 제품을 국내 의자 시장에 지속적으로 선보이고 있음.
출처 : 에프앤가이드"
신세계건설,"토목,건축,건축관련기술서비스,빌딩관리용역,골프장,내장공사,시설개보수,설계용역",건물 건설업,"기업개요
동사는 1991년 3월 20일에 회사가 설립되었으며, 당사의 주식은 1999년 6월 23일 코스닥시장, 2002년 6월 17일 유가증권시장에 상장함.
동사의 건설부문은 백화점/할인점/아울렛몰 등 대형판매시설의 건설, 오피스/오피스텔/주거시설의 신축을 주된 사업의 영업기반으로 삼고 있음.
월별로는 5월, 6월, 10월 이용객수가 가장 많은 성수기이며, 야외 스포츠의 특성상 1월과 2월은 추위와 눈으로 인하여 비수기임.
출처 : 에프앤가이드"
아이에스동서,"타일,위생도기,콘크리트파일,P.C관,침목 제조,도매","시멘트, 석회, 플라스터 및 그 제품 제조업","기업개요
동사 및 종속회사는 콘크리트사업부문, 건설사업부문, 환경사업부문, 해운사업부문, 기타사업부문으로 구성되어 있음.
주요 사업인 콘크리트사업부문은 PHC PILE, Ext PILE 외 건축자재를 생산/판매하며, 건설사업부문은 건축, 토목공사를 바탕으로 아파트 및 상가를 공급함.
또한 환경사업부문은 폐자원, 골재판매, 폐기물 처리용역 및 환경설비건설 등의 사업을 영위함.
출처 : 에프앤가이드"
우진,원전용계측기,"측정, 시험, 항해, 제어 및 기타 정밀기기 제조업; 광학기기 제외","기업개요
동사는 1980년 설립, 2010년 7월에 상장한 산업용 및 원자력발전소용 계측기 제조전문 기업임.
동사는 계측기 이외에 철강산업용 자동화장치, 설비진단시스템, 유량계 및 유량시스템 등을 주요 사업으로 하고 있으며 2020년 12월에 온도센서 사업을 인수하였음.
경기 흐름에 둔감한 시장 제품의 오랜 Life Cycle과 산업의 고도화에 따른 시장 규모의 확대가 산업의 특징임.
출처 : 에프앤가이드"
인터지스,"화물운송,알선,하역",도로 화물 운송업,"기업개요
동사는 1956년 2월 23일 항만하역업, 화물운송업 등을 주 목적으로 하여 설립됨. 2011년 12월 16일 한국거래소 유가증권시장에 주식을 상장함.
컨테이너 및 벌크화물 등을 하역하는 항만하역사업과 철강제품 및 수출입 컨테이너를 운송하는 육상운송사업, 그리고 동국제강의 철강 원재료 및 국내외 3PL 고객들을 대상으로 하는 해상운송사업과 포워딩사업을 영위함.
그 외 터미널 운영과 주유소 등의 부수사업을 수행하고 있음.
출처 : 에프앤가이드"
일성건설,"건축공사,토목공사,전기공사",토목 건설업,"기업개요
동사는 1978년 설립되어 토목공사와 건축공사, 녹지조성사업 등의 조경공사, 아파트 분양사업 등으로 성장해 온 종합건설회사임.
T/K, SOC(BTL) 등 발주 공사의 입찰에 참여하고 있으며 신탁, 재정비 및 재개발사 FED 및 해외 토목 등 시장 개척을 통한 수주 확대, 공공택지를 통한 분양사업 활성화에 주력하고 있음.
'트루엘'이라는 아파트브랜드로 자체(분양)사업도 추진하고 있음.
출처 : 에프앤가이드"
진에어,"여객, 화물 등 항공운송",항공 여객 운송업,"기업개요
항공항공운송산업에 속한 회사이며, 현재 항공기를 이용한 운송 서비스를 주요 상품으로 하여 소비자에게 판매 중.
2023년 3월말 기준 동사는 리스계약을 통하여 BOEING 737-800 19대, BOEING 737-900 2대, BOEING 737-8 1대, BOEING 777-200 4대, 총 26대를 보유
동사는 예약, 발권 등의 기능을 통해 생산과 판매가 일어나는 무형의 서비스를 제공하고 있기 때문에 재고가 잔존하지 않음.
출처 : 에프앤가이드"
코오롱글로벌,"토목공사,일반건설,주택건설,해외건설,소각로설비공사/환경플랜트,폐처리기 제조",토목 건설업,"기업개요
동사는 1960년 협화실업으로 설립되어, 2011년 코오롱아이넷주식회사와 코오롱비앤에스주식회사를 흡수합병하여 코오롱글로벌주식회사로 상호변경.
건설사업부문은 ""코오롱하늘채"", ""린든그로브""와 같은 주택 브랜드를 앞세운 주택 및 건축 분야와, 도로/교량 등을 시공하는 토목분야 및 SOC사업을 영위.
해외 상하수도 시설을 시공하는 환경 사업, 풍력발전을 포함한 신재생에너지 사업 등으로 이루어진 종합 건설업을 영위.
출처 : 에프앤가이드"
포스코인터내셔널,"무역(철강,화학,자동차부품),수출주선,대행,알선,가공원단,폴리우레탄,자동차시트 제조",상품 중개업,"기업개요
2000년 12월 대우의 무역부문의 인적분할을 통해 설립되었으며, 2010년 8월 포스코가 한국자산관리공사 등으로부터 지분 68.2%를 취득하여 최대주주가 됨.
2020년 철강 가공사업을 물적 분할함. 2023년 1월 LNG사업 밸류체인 완성을 위해 포스코에너지를 흡수합병함.
무역업을 중심으로 자원개발, 인프라 개발·운용 등의 사업을 영위하고 있으며, 철강, 곡물, 화학, 이차전지소재, 친환경차부품, 천연가스 등이 주요 품목임.
출처 : 에프앤가이드"
한솔로지스틱스,"지류펄프 보관창고 운영/화물취급,화물운송알선,물류컨설팅/종합쇼핑몰운영,통신판매,인터넷백화점",기타 운송관련 서비스업,"기업개요
동사는 1996년 10월 한솔그룹으로 대주주지분이 양도됨에 따라 1996년 12월 한솔 유통으로부터 물류사업을 양수받아 물류서비스 전문회사로 사업에 새롭게 진출하였음.
1997년 2월에는 영우통상의 사명을 한솔CSN으로, 2014년 5월에는 한솔로지스틱스 주식회사로 변경하였음.
동사는 컨테이너운송사업/트럭운송사업/해상 및 항공 포워딩사업/W&D/물류시스템 및 산업별 물류서비스를 고객에게 제공하고 있음.
출처 : 에프앤가이드"
한일홀딩스,지주사업,"시멘트, 석회, 플라스터 및 그 제품 제조업","기업개요
시멘트 제조 및 판매업 등을 목적으로 1961년에 설립되었으며, 1969년 상장함.
판매한 건자재의 최종 고객은 건설사이며, 동사가 건설사와 직접 거래를 하기도 하지만, 동사와 건설사의 중간 유통단계에서 사업을 영위하는 레미콘사나 건자재 대리점을 주 거래처로 두고 있음.
기타 사업부문에서 서비스 부문 및 IT 장비 유통의 경우 일반 기업체 및 기관이 주 거래처이며, 테마파크의 경우 개인 및 단체 관광객이 고객임.
출처 : 에프앤가이드"
한화,"화약,화공품,자동선반류,공작기계 제조,전자교환기,건설,정보통신,종합무역/임직원 및 개인대상 교육,세미나 및 워크샵 중계,동영상광고",기타 화학제품 제조업,"기업개요
한화그룹의 지주회사 역할을 하고 있으며 한화생명, 한화에어로스페이스, 한화케미칼 등 계열사 지분 보유, 자체사업은 화약/방산/기계/무역 부문이 있음.
화약부문은 발파기술사업, 발파해체사업, 불꽃프로모션사업 등으로 사업영역을 확대, 방산부문은 정밀유도무기를 포함한 정밀타격 전 분야로 사업영역을 확대.
기계부문은 주요 산업별 핵심설비 개발 및 프로젝트 수행능력을 확보, 무역부문은 자체 영업권과 전문성을 보유한 사업의 확대.
출처 : 에프앤가이드"
현대건설,"공사수입,주택분양,건설산업부문 설계,감리 등 엔지니어링서비스",토목 건설업,"기업개요
1950년 토목과 건축공사를 주요 사업목적으로 설립되었으며, 2022년 시공능력평가 2위의 종합건설회사임.
주요사업 부문은 터널, 교량, 도로공사, 택지조성, 철구조물 제작 및 설치 등의 토목 부문과 공공건축물 및 초고층빌딩, 아파트 등을 건설하는 건축/주택 부문,
석유화학/담수/신산업 플랜트, 송변전 전기공사, 원자력/태양광/풍력발전 등을 담당하는 플랜트 부문, 부동산개발, 축산업, 휴양콘도운영 등의 기타 부문으로 나뉨.
출처 : 에프앤가이드"
현대로템,"철도차량, 특수중기, 산업기계",철도장비 제조업,"기업개요
동사는 1999년 설립되어 레일솔루션 사업, 디펜스솔루션 사업, 에코플랜트 사업을 영위하고 있음.
레일솔루션사업본부는 국내를 넘어 세계시장에 전동차, 고속전철, 경전철 등 각종 철도차량을 공급하고 있음.
디펜스솔루션사업본부는 지상무기체계의 연구개발 및 생산을 담당하고 있으며, 에코플랜트사업본부는 높은 기술력을 바탕으로 국내외 다수의 철강 및 자동차 생산인프라 등의 공사를 수행하고 있음.
출처 : 에프앤가이드"
KD,건설사업(완성건물),건물 건설업,"기업개요
동사는 건설부문(오피스텔, 아파트 등 건축 및 분양)과 전자부문(전자통신부품 검사용역)사업을 영위하고 있음.
주택부문은 경기변동과 금융상황에 민감하게 반응하는 산업분야로, 경기회복과 금융산업의 안정화 등의 여부에 따라 영향을 받음.
동사는 직접 건축하여 분양하거나, 동 건축물에 대한 수주로 건축을 하고 있으며, '아람채', 'KDU프라자' 와 같은 고유 브랜드를 보유하고 있음.
출처 : 에프앤가이드"
KT서브마린,해저케이블등의 건설 및 유지보수 업무,전기 및 통신 공사업,"기업개요
동사는 1995년 설립되어 해저통신케이블과 해저전력케이블의 시공 및 유지보수 사업을 영위하고 있음. 동사의 매출품목은 건설공사, 유지보수, 기타부문으로 구분됨.
해저전력케이블 건설사업은 한국전력공사(KEPCO), 국내외 신재생에너지 개발사 또는 대형 건설사(EPC 사업자)가 주로 발주하고 있음.
국내 해저통신케이블 건설시장에서는 동사가 독점적으로 수행하고 있음.
출처 : 에프앤가이드"
그린플러스,"첨단유리온실, 온실용자재설치공사, 알루미늄 압출/가공제품",1차 비철금속 제조업,"기업개요
동사는 1997년 10월, 알루미늄 제품과 온실용 자재 제조 및 판매를 주 목적으로 설립되었음.
알루미늄 압출 생산라인을 기반으로 첨단온실의 기획부터 설계 자재 제작과 시공까지 첨단온실사업의 전 영역을 대응할 수 있는 역량을 보유하고 있으며, 이를 바탕으로 한국형 스마트팜 보급을 선도하는 기업을 목표로 함.
종속회사로 장어양식사업을 영위하는 그린피시팜과 스마트팜 딸기 재배 사업을 영위하는 그린케이팜 등이 있음.
출처 : 에프앤가이드"
넥스턴바이오,CNC자동선반,특수 목적용 기계 제조업,"기업개요
동사는 2000년 설립된 CNC자동선반 제조 및 판매 기업임. 동사의 사업부문은 CNC자동선반 단일부문으로 구성됨.
매출유형은 제품, 상품, 기타 등으로 구분됨. 제품매출은 자동차, 선박엔진, 통신 부품 및 의료용기기 등에서 발생함.
CNC자동선반 국내시장은 한화기계의 독점형태로 진행되었지만 동사의 진입으로 현재 과점상태에 있으며, 동사는 37% 내외의 시장을 점유하고 있는 것으로 추정함.
출처 : 에프앤가이드"
동방선기,"조선기자재, 선박용 배관",선박 및 보트 건조업,"기업개요
동사는 1994년 설립되어 배관 제작, 생산, 판매업를 주력 사업으로 영위하고 있으며, 부산에 3곳의 제조시설을 두고 있음.
동사의 사업부문은 PIPE SPOOL사업부문, 도장사업부문으로 이루어져 있으며, 타 산업향 배관 사업을 향후 더욱 확대하고자 합.
PIPE SPOOL사업부문에서는 탄소강관, 스테인리스강관 등 제조 및 판매를, 도장사업부문에서는 PIPE, 철의장품 도장을 영위하고 있음.
출처 : 에프앤가이드"
동양파일,PHC파일,"시멘트, 석회, 플라스터 및 그 제품 제조업","기업개요
동사는 2013년 6월 12일에 콘크리트파일의 제조, 판매등을 주 목적으로 설립되었음.
동사의 매출은 PHC파일 시장의 특성상 내수 위주로 구성되어 있으며, 판매활동은 거래처에서 직접 주문을 받아 직접 판매 방법으로 이루어지고 있음.
콘크리트 파일 산업은 초기 투자비가 많이 드는 장치산업으로 진입장벽이 높고 시장이 내수중심으로 형성되어 있으며, 경기 변동에 영향을 많이 받음.
출처 : 에프앤가이드"
드림시큐리티,정보보안솔루션,소프트웨어 개발 및 공급업,"기업개요
동사는 자체 보유한 기술력 및 전문인력을 통해 행정, 공공기관, 금융기관, 일반업체 등 다양한 기관에 PKI/인증, 유선보안, 무선보안, 전자문서 보안 분야 등의 솔루션 공급 및 SI 사업을 영위함.
동사의 제품과 서비스는 대부분 정보보안산업의 정보보안제품 중 시스템 보안, 정보유출방지 및 암호인증분야에 집중되어 있음.
대체인증 수단의 필요성이 대두되며 FIDO 기반의 생체인증 기술을 개발하여 FIDO 글로벌 공인인증을 획득함.
출처 : 에프앤가이드"
삼영엠텍,"구조용 특수장치, 교량부품","구조용 금속제품, 탱크 및 증기발생기 제조업","기업개요
동사는 1997년 삼영소재산업으로 설립되었으며, 연결회사는 플랜트 기자재, 구조물 구조재, 선박엔진 구조재 및 풍력 기자재 등을 생산하고 있음.
2022년 우리나라는 2018년 이후 최대 수주 점유율을 기록하였으며, 이에 따라 선박엔진 기자재도 수요가 증가할 것으로 예상됨.
세계경제 불확실성이 커지면서 세계철강시장은 약화된 모습을 보이나, 북미 및 중동지역의 신규 에너지 프로젝트 진행으로 인프라 수요는 소폭 증가할 것으로 예상됨.
출처 : 에프앤가이드"
삼표시멘트,"시스템통합(SI), 네트워크장비",기타 비금속 광물제품 제조업,"기업개요
지배회사인 동사 및 종속회사는 시멘트 사업을 영위하고 있으며 시멘트, 크링커, 석회석 등을 제조 및 판매하고 있음
레미콘사업 진출을 위하여 삼표레미콘을 설립하였으며, 2021년 9월 30일자로 삼표산업과 에스피네이처의 레미콘 사업부분을 인수 완료함.
삼표자원개발(주)는 풍부한 매장량을 기반으로 한 시멘트의 주 원료인 양질의 석회석 생산량 전량을 (주)삼표시멘트에 안정적으로 공급중임.
출처 : 에프앤가이드"
