Company,items,industry,description
매일유업,"유제품(우유, 분유, 발효유, 치즈, 음료 등)",낙농제품 및 식용빙과류 제조업,"기업개요
2017년 5월 매일유업에서 인적분할 되었으며, 낙농품 및 음료 제조판매/수출입 등을 주요 사업으로 영위.
주요 제품으로는 매일우유, 상하목장 유기농우유, 앱솔루트 명작, 매일바이오, 뼈로가는 칼슘두유 등이 있으며 2023년 3월 말 기준 국내업계 중 최다인 총 17품목의 특수분유를 운영.
백색우유 시장 내 동사의 유기농 제품은 시장점유율 78%로 1위를 견고히 지키고 있음.
출처 : 에프앤가이드"
에스앤디,"일반기능식품소재, 건강기능식품소재",기타 식품 제조업,"기업개요
식품에 기능을 부여하는 일반기능식품소재 및 건강기능식품소재를 생산, 판매하고 있으며, 생활용품 및 화장품에 이용되는 천연물 소재의 연구, 개발로 사업영역을 다각화 하고 있음.
식품GMP, ISO, HACCP, HALAL 등 각 인증기준에 의해 위생적으로 설계된 설비를 바탕으로 기능성식품소재의 연구개발 및 생산·판매를 하고 있음.
주요 사업분야는 일반기능식품소재와 건강기능식품소재로 구분하고 있음.
출처 : 에프앤가이드"
인산가,죽염 및 죽염응용식품,기타 식품 제조업,"기업개요
죽염 및 죽염응용식품 전문 제조·유통 업체로, 오랜 기간 동안 최고 품질의 죽염과 죽염응용식품을 개발, 생산하여 국내외 시장에 공급.
세계 최초로 죽염을 산업화한 기업으로 죽염시장 내에서 1위를 확고히 고수, 죽염 및 죽염응용식품의 대중성 확보를 위해 생활식품과 관련한 제품들을 출시하고 있음.
2017년부터 종합식품 대기업과의 Co-Marketing을 통해 브랜드 홍보 확대 및 유통경로 전용 신제품 개발을 진행.
출처 : 에프앤가이드"
태양,"휴대용 부탄가스, 에어졸캔, 외주수탁품",기타 금속 가공제품 제조업,"기업개요
동사는 관(분사용관, 기타 유사관) 및 가스충전 제조판매업, 무역업 등을 영위할 목적으로 1989년 설립되어, 휴대용 부탄가스 사업과 에어졸 사업을 영위하고 있음.
휴대용 부탄가스 사업은 국내 최대 시장점유율 차지하고 있으며 세계 시장에서도 60% 이상의 점유율을 차지하고 있음.
에어졸은 OEM방식으로 납품하고 있으며, 관계사인 승일과 더불어 국내 1위 점유율을 차지하고 있음.
출처 : 에프앤가이드"
교촌에프앤비,치킨 프랜차이즈,음·식료품 및 담배 도매업,"기업개요
동사의 사업은 크게 치킨 브랜드인 '교촌치킨'의 국내 및 해외 프랜차이즈 업무를 담당하는 국내 프랜차이즈 및 글로벌 사업부문과 커머스/신사업으로 구분할 수 있음.
커머스/신사업부문을 통해 HMR, 소스 등 식품가공 및 유통 시장 확장, 그리고 수제맥주 등 신사업 진출을 도모하고 있음.
글로벌 사업은 미국과 중국에 직영 매장을 운영 중이며 말레이시아, 인도네시아, 태국, 중동 등에는 마스터 프랜차이즈 형태로 진출해 있는 상황임.
출처 : 에프앤가이드"
사조산업,"원양어업(참치,명태,오징어),육가공,참치통조림,장류 제조/냉동냉장 창고운영/부동산 임대/컴퓨터,소프트웨어 개발,도매/팝콘,구운김 도매",어로 어업,"기업개요
동사는 원양어업, 식품, 축산, 레저부문 등의 사업을 영위하고 있으며, 동사를 포함하여 사조씨푸드, 캐슬렉스서울 등 총 8개 법인이 연결 대상법인에 포함됨.
주요 사업영역인 원양사업은 참치연승, 참치선망, 대구저연승사업으로 구분되며, 주요 제품으로 참치, 대구 등이 있음.
참치연승사업은 주로 적도 부근 태평양, 인도양, 대서양, 남부인도양 등에서 횟감용 고급참치를 어획하며, 대부분을 일본으로 수출하여 외화획득에 공헌함.
출처 : 에프앤가이드"
삼양식품,"라면,스낵,유제품,장유,식용유,사료,향신료,건강음료(루이보스 티) 제조,도매",기타 식품 제조업,"기업개요
동사는 1961년 유지공업과 식품도매업을 영위하기 위하여 설립되었으며, 면류, 스낵류, 유제품, 조미소재류 등을 제조하여 판매하고 있음.
국내 최초의 원조라면 삼양라면을 포함한 불닭볶음면, 볶음짜짜로니, 간짬뽕, 나가사끼짬뽕, 쇠고기면, 맛있는라면, 짱구, 사또밥 등 다양한 식품을 생산 판매함.
웰빙트렌드에 맞춰 소비자 건강에 대한 욕구를 충족시키기 위해 우수한 품질의 신제품을 개발함.
출처 : 에프앤가이드"
대주산업,배합사료,동물용 사료 및 조제식품 제조업,"기업개요
1962년 한국축산사료산업의 태동기에 창립하여 50여년간 배합사료 제조업에 전념해온 동사는 1987년 인천에 일산 약520톤 규모의 양축사료 생산공장을 가동.
오랜 노하우로 축적된 제조기술을 바탕으로 우수한 사료 제품을 생산하는 배합사료 전문업체임.
종속회사인 농업회사법인 주식회사 남부팜은 2011년 9월 1일 오리 위탁사육을 목적으로 개설되었으며. 위탁사육농가와 계약을 통하여 사육을 하고 있음.
출처 : 에프앤가이드"
스피어파워,화장품,"펄프, 종이 및 판지 제조업","기업개요
동사는 2005년 설립되었으며, 2015년 KB 제3호 기업인수목적 주식회사와 합병을 통해 코스닥 시장에 상장함.
주요사업으로 AAPE(지방 줄기세포 유래 단백질 추출물) 기반 화장품, 의료기기 등을 공급업을 영위하고 있으며, ""AAPE 홈케어"" 라인 등이 있음.
연결대상 종속회사로 화장품 도소매업을 영위하는 중국소재 한산취국제무역(북경)유한책임공사와 더마베이비가 있음. 더마베이비는 현재 청산절차가 진행중임.
출처 : 에프앤가이드"
우양,"HMR, 음료 베이스, 퓨레 등","과실, 채소 가공 및 저장 처리업","기업개요
동사는 1992년 설립되었으며 농축수산임산물 및 과실통조림/유사조제식품/즉석조리식품 제조, 수출입 등 식품제조업을 전문으로 한 사업을 영위.
‘뉴뜨레’와 ‘쉐프스토리’라는 자체 브랜드를 통해 일반 소비자에게 직접 판매할 수 있는 제품라인업 및 판매망 확장.
주요 매출처는 CJ제일제당, 풀무원식품 등과 같은 제조유통사와 스타벅스, 이디야, 할리스 등과 같은 외식 프랜차이즈업체이고 식품 사업에 필요한 다양한 제조솔루션을 제공함.
출처 : 에프앤가이드"
풍국주정,발효주정,알코올음료 제조업,"기업개요
소주의 원료로 사용되는 주정을 생산, 공급할 목적으로 1954년 설립됨. 주정과 산업용가스, 수소 및 아세틸렌을 제조하고 있음.
동사는 1953년 창립이후 한국 주류산업의 역사와 함께한 풍국주정공업과 산업용가스 기초 소재 산업에서 큰 도전과 혁신으로 새로운 미래를 열어가고 있는 선도산업과 에스디지가 함께 하는 기업임.
효성, SK어드밴스드, 대한유화공업, 롯데BP로부터 수소 원료가스를 공급받아 양질의 초고순도 수소를 생산함.
출처 : 에프앤가이드"
한일사료,배합사료,동물용 사료 및 조제식품 제조업,"기업개요
동사와와 그 종속기업은 배합사료 제조, 수입육 유통 판매 전문 기업으로 동물용 배합사료, 수입육 등의 사업 영역에서 양계사료, 축우사료, 수입육(우육, 돈육) 등을 생산, 판매함.
배합사료 공장은 국내 1개(경기도용인시 소재) 가동 중이고, 수입육은 미국, 유럽 등에서 수입하고 있음.
사료제조 및 매매업, 양곡매매업, 수출입업, 목축 및 종축업, 부화업 등을 동사의 주요 사업으로 함.
출처 : 에프앤가이드"
남양유업,"시유,조제분유,발효유,이유밀,치즈,프렌치까페 제조,도매",낙농제품 및 식용빙과류 제조업,"기업개요
동사는 유가공 전문업체로서 총 5곳의 제조시설을 보유하고 있으며, 영업 사업부문은 생산하는 제품의 형태에 따라 우유류, 분유류, 기타로 분류됨.
우유류에는 맛있는우유GT, 아인슈타인GT 등이 있으며 분유류에는 아이엠마더, 임페리얼XO 등의 제품군을 보유함.
기타 사업 부문으로는 몸이가벼워지는시간17차, 드빈치치즈, 외식사업, 건강한사람들(음료생산 및 OEM), 금양흥업(부동산경영 및 임대업)이 있음.
출처 : 에프앤가이드"
대상,"전분,라이신,물엿,과당,포도당,MSG및 사료,조미료,항생제,핵산,커피 제조,도매/토목공사,건축공사",기타 식품 제조업,"기업개요
동사는 조미료 및 식품첨가물 제조업 등을 영위할 목적으로 1956년 1월 31일에 설립되었으며 1970년 상장함.
식품사업은 국내 대표적인 종합 식품 브랜드인 '청정원'을 중심으로 '순창고추장' 등 전통 장류부터 '미원' 등의 조미료류, 식초, 액젓 등의 농수산식품, 서구식품, 육가공식품, 냉동식품 등을 판매.
소재사업은 국내 최대의 전분 및 전분당 생산규모를 보유한 전분당 사업과 바이오 사업으로 구성됨.
출처 : 에프앤가이드"
대한제당,"제당,가축용 배합사료,설탕,기능성감미료(자일로올리고당),외식산 제조,도소매/부동산 임대","곡물가공품, 전분 및 전분제품 제조업","기업개요
동사의 주요사업부문은 식품, 축산유통 및 기타로 구성되어 있으며 종속회사의 사료사업부문 및 골프장, 외식업 등이 있음.
주요 제품으로는 식품부문의 설탕 및 조제품, 사료부문의 배합사료가 있으며축산유통부문의 주요 상품은 수입육 및 수산물이 있음.
제당식품부문에서 국내에서는 실수요처, 대리점, 대형할인점을 통해 해외에서는 주로 아시아지역 국가의 실수요처 및 중간무역업체을 통해 판매경로 확보함.
출처 : 에프앤가이드"
샘표,"간장,된장,고추장 제조,가공,판매,무역",기타 금융업,"기업개요
동사는 자회사 관리 및투자를 목적으로하는 지주회사 부문과 식품 제조 및 판매를 목적으로하는 식품사업 부문으로 영업부문을 구분하여 운영하고 있음.
지주사업 부문은 샘표 주식회사, 식품사업 부문은 샘표식품(주), 양포식품(주), (주)샘표아이에스피, 조치원식품(주)의 회사가 있음.
지주사업 부문인 샘표 주식회사는 지분법 수익, 배당 수익, 임대 수익, 브랜드 수익 등의 수익이 있음.
출처 : 에프앤가이드"
신라교역,"원양어업(참치,명태,휠레트,연육,명란,새우),어획물 판매/직물 수출",어로 어업,"기업개요
동사는 원양어업부문, 수산물유통부문, 철강사업부문, 농산물중개부문, 기타사업부문을 영위하고 있음.
원양어업부문에서는 중서부태평양에서 참치를 어획하여 판매하는 사업으로, 조업방법에 따라 횟감용 참치를 어획하는 참치연승어업과 통조림용 참치를 어획하는 참치선망어업이 있음.
철강사업부문은 국내에서는 포스코, 현대제철의 철강제품을 해외에서는 중국, 일본, 인도 등에서 철강제품을 매입하여 판매하고 있음.
출처 : 에프앤가이드"
크라운제과,"비스킷, 스낵, 당과",기타 식품 제조업,"기업개요
2017년 인적 분할로 설립되어 분할 전 회사인 크라운제과홀딩스가 영위하던 사업 중 식품제조 및 판매를 담당하는 식품사업부문을 담당하고 있음.
주요 4대 제과업체로서 높은 시장점유율을 보이며, 주요 제품으로는 초코하임, 쿠크다스, 뽀또, 미니쉘, 빅파이 등이 있음.
서울에 위치한 본사를 포함하여 국내에 총 3개의 생산공장(대전, 진천, 아산)과 각 시·군의 물류창고 등에서 사업활동을 수행함.
출처 : 에프앤가이드"
크라운해태홀딩스,"비스켓,쵸코렛,사탕,웨이퍼 제조,도매",기타 금융업,"기업개요
동사는 2017년 3월 1일을 분할기일로 하여 투자사업부문과 식품사업부문을 인적분할의 방법으로 분할하였음.
분할되는 회사는 식품제조 및 판매를 담당하는 식품사업부문과 자회사 지분의 관리 및 투자를 목적으로 하는 투자사업부문의 분리를 통하여 지주회사로 전환함.
동사와 그 주요 종속회사의 사업부문은 지주부문, 제과부문(크라운제과, 해태제과식품, 훼미리식품), 기타부문으로 나뉘고 있음.
출처 : 에프앤가이드"
CJ프레시웨이,"식자재유통, 단체급식",음·식료품 및 담배 도매업,"기업개요
1988년 10월 설립된 동사는 대한민국을 대표하는 식자재유통 및 푸드서비스(단체급식) 기업임.
사업부문은 크게 식자재유통사업 및 푸드서비스사업, 제조/서비스업으로 구성되어 있으며, 업계 최고 수준의 위생/안전시스템, 물류/IT 인프라를 보유하고 있음.
최근 1인가구의 증가 및 가정 간편식(HMR)시장의 성장으로 수요가 높아지고 있는 맞춤형 식자재 공급에 대한 자체 제조 기반을 확보함.
출처 : 에프앤가이드"
DSEN,"외식프랜차이즈사업,육류가공,식자재유통등",음·식료품 및 담배 도매업,"기업개요
동사는 2005년 8월 30일 설립되어 대전광역시 동구 계족로에 본사를 두고 축산물의 가공, 유통, 제조, 판매를 주요 사업으로 함.
2023년 1월 3일에 ㈜미스터피자가 물적분할로 설립됨. ㈜미스터피자의 불균등 유상증자로 인하여 동사의 지배력이 상실되어 종속기업에서 관계기업으로 변경.
대전 지역 시장점유율 1위 기업으로서 안정적인 돈육을 기반으로 돼지고기 프랜차이즈 사업, B2B 돈육납품, B2C 온라인판매 등의 사업 준비 중.
출처 : 에프앤가이드"
동우팜투테이블,"육계,삼계","도축, 육류 가공 및 저장 처리업","기업개요
양계, 종란, 부화, 사육,가공,판매에 이르는 일련의 전과정을 계열주체인 동사가 일괄적으로 지휘총괄하는 사업을 영위하고 있음.
Farm to Plate System(농장에서 소비자 식탁까지)과 One day System(당일생산, 당일출하) 및 Cold Chain System(냉장유통출하)을 도입함.
브랜드 '동우 바른닭고기'를 중심으로 제품인지도 향상, 판매다각화 및 시장개척을 위해 노력하는 중임.
출처 : 에프앤가이드"
케이엠제약,"구강제품, 화장품,기타 생활용품",기타 화학제품 제조업,"기업개요
동사는 2001년 3월 26일에 설립되었으며 주요 사업으로 오랄케어, 뷰티케어, 기타 생활용품 등 제조 및 도소매업을 영위하고 있음.
동사의 주력제품은 유아용/성인용 치약칫솔제품, 그리고 유아용/성인용 샴푸 및 바디워시, 주름기능성화장품등 스킨케어 제품임.
주력 목표시장은 필수 소비재인 치약/칫솔 등의 구강용품시장(오랄케어)과 목욕제품 및 화장품시장이며, 유통채널은 크게 직접납품과 대리점, OEM/ODM 등으로 나눌 수 있음.
출처 : 에프앤가이드"
큐로홀딩스,"DTIS, Probe Card, H.F PCB",음·식료품 및 담배 소매업,"기업개요
동사는 1987년 12월에 에스비텍 주식회사로 설립되어 2008년 3월 27일 주식회사 큐로홀딩스로 상호를 변경하였음.
동사가 영위하는 주 사업영역은 엔터테인먼트 사업부문, 커피 사업부문, 자원개발 사업부문으로 구성됨.
엔터테인먼트 사업부문은 지배회사인 동사를 중심으로 영화ㆍ드라마 등의 영상 콘텐츠 제작, 연예인 매니지먼트, 보조출연자 공급 에이전시 등을 주요사업으로 영위하고 있음.
출처 : 에프앤가이드"
팜스토리,사료,동물용 사료 및 조제식품 제조업,"기업개요
동사는 1991년 4월 17일 서일산업으로 설립되어 1996년 6월 29일 코스닥시장에 상장함.
동사의 사료부문은 사료산업의 성장 둔화 및 70년대 대기업의 사료산업 진출 등 어려운 시장 환경속에도 적합설계 및 사료효율을 개선하여 효율성과 경제성을 동시에 이루어 내며 매년 높은 성장을 지속하여 왔음.
배합사료산업은 국민소득 증대에 따른 식생활 수준의 향상에 힘입어 육류소비량이 증가하면서 지난 30여 년 동안 성장을 지속하여 왔음.
출처 : 에프앤가이드"
SPC삼립,"빵,아이스크림,과자,케익,유산균음료,인스턴트식품,병조림,면류,식용유 제조,판매",기타 식품 제조업,"기업개요
동사는 1945년 상미당을 설립하고 1968년 삼립식품공업주식회사로 법인 전환한 후, 제과 및 식품 판매유통사업을 영위하며 종합식품기업으로 발돋움함.
빵, 샌드위치, 케이크류 등을 제조/판매하는 Bakery사업부문, 밀가루, 계란, 육가공품, 신선식품 제조/판매 및 직영점/휴게소를 운영하는 Food사업이 있음.
또한 식재료 및 관련 식자재 유통 및 단체급식을 제공하는 유통사업부문, 그 외 물류 사업 등의 기타사업부문으로 구성됨.
출처 : 에프앤가이드"
사조오양,"원양어업/수산물가공(게맛살) 제조,수출입/냉동 및 냉장보관/부동산 임대",수산물 가공 및 저장 처리업,"기업개요
동사는 1969년 설립되어 식품제조, 원양어업, 기타부문(상품, 임대)의 사업영역을 구축하여 성장 발전하였고 업계 최초로 맛살제품을 국내에 도입하였음.
동사는 식품제조, 수산물, 기타부문 등으로 사업영역이 구분되어 있음.
식품제조 부문에서 평택, 금산, 양산, 임실 공장은 각각 육가공, 맛살, 어묵육가공, 만두를 제조하여 공급하며 동사에서 생산되는 제품은 영업본부를 통한 판매 및 사조대림에 공급되고 있음.
출처 : 에프앤가이드"
삼양사,설탕,기타 식품 제조업,"기업개요
동사는 2011년 삼양홀딩스로부터 인적 분할되어 설립되었으며, 사업부문은 크게 식품부문과 화학부문으로 구성.
식품부문의 주요 제품으로는 설탕, 밀가루, 유지, 전분당 등이 있으며, 화학부문의 주요 제품으로는 엔지니어링 플라스틱, PET병 용기, 터치패널용 소재 등이 있음.
급변하는 외부상황에 따른 불확실성, 협상타결 여부, 당사자간 약정 준수 등 여러 변수에 따라 사업화 대상과 시기가 가변적일 수 있음.
출처 : 에프앤가이드"
메지온,"발기부전증치료제, 전립선비대증치료제",자연과학 및 공학 연구개발업,"기업개요
2002년 동아제약에서 동아팜텍으로 분사하여 2013년 현 상호로 변경하였으며 신약후보 물질의 도입, 개발, 기술이전 사업을 영위 중인 C&D업체임.
동아에스티 발기부전치료제 자이데나의 성분 유데나필의 북미와 러시아, 멕시코 특허 보유로 마일스톤과 국내의료기기 부문 매출이 주 수익원임.
발기부전증 및 전립선비대증, 발기부전증과 전립선비대증의 동시적응증, 폰탄수술 치료제 등의 용도로 유데나필의 임상 3상 진행 중에 있음.
출처 : 에프앤가이드"
신라에스지,수산물도매,음·식료품 및 담배 도매업,"기업개요
동사는 1977년 8월 18일에 설립하여 1995년 6월 30일에 코스닥시장에 상장하였음.
동사의 주요사업은 식품제조업으로서 그 품목에는 어육소시지, 수산물 가공, 수산물 도소매 등이 있으며, 유통사업으로 수산물 유통, 축육(우육, 돈육 등) 도소매를 하고 있음.
통조림 자사제품은 ""동표""로 판매하고 있으며, 어육소시지는 CJ제일제당에 OEM으로 납품을 하고 있음.
출처 : 에프앤가이드"
엠에스씨,식품첨가물,기타 식품 제조업,"기업개요
식품첨가물 제조업을 필두로 현재는 식품부문 사업까지 영위하는 식품 및 식품첨가물 신소재 전문회사임.
2017년 12월 HACCP 의무화 시행에 따라 식품 전제품에 HACCP를 적용하는 등 식품안전 강화에도 노력 중임.
기능성 식품 소재 개발 필요성 제고와 천연소재 인지도 향상에 따라 식품 뿐 아니라 의약품, 생활용품 등의 다양한 분야에 활용 가능한 신소재, 색소, 향료 등의 연구개발에도 주력 중.
출처 : 에프앤가이드"
이지바이오,"자돈사료, 사료첨가제",동물용 사료 및 조제식품 제조업,"기업개요
동사는 동물용 약품,배합사료, 기능성 식품의 제품 제조, 판매를 목적으로 하는 사업을 하고 있으며 2020년 5월 1일을 분할기일로 하여 6월 5일 코스닥 시장에 재상장함.
현재 사료첨가제 부문에서 동사는 항생제 대체체로 사용되는 미생물제, 추출제를 주요 제품으로 생산하고 있음.
동사의 주요 제품 중 하나인 주요 제품이라고 할 수 있는 원가 절감형 첨가제인 효소제는 약 1.6조원 규모로 추정됨.
출처 : 에프앤가이드"
진로발효,주정,알코올음료 제조업,"기업개요
1985년 진로의 영등포공장에서 독립법인으로 설립된 동사는 주류, 식품, 소독용 알콜 제조 및 판매 사업을 영위.
국내 총 9개의 주정사가 전국에 각 지역별로 고르게 분포되어 있으며 각사별 시장 점유율에 따라 원료 배정 및 제품 생산량이 결정됨.
주요사업인 주정사업은 대부분 대한주정판매주식회사에 납품하고 있으며, 각 소주 제조회사가 주정을 대한주정판매주식회사로부터 구입하는 방식으로 유통과정의 단순화, 투명화에 대해 노력하고 있음.
출처 : 에프앤가이드"
체리부로,"육계, 사료","도축, 육류 가공 및 저장 처리업","기업개요
동사는 계육제품의 생산 및 판매사업을 주요사업으로 하고 있는 수직계열화 업체이며 사업부문은 육계부문, 육가공유통부문, 종계 및 부화부문으로 나눌 수 있음.
원재료 및 자재와 육성 기술, 위탁수수료 등을 제공하고 육계를 공급받고 있는 육계계열화 업체 중심으로 육계 시장이 형성되어 있음.
동사는 닭고기의 생산 공급, 유통과 관련된 전 사업부문을 담당하는 육계계열화업을 영위하고있음.
출처 : 에프앤가이드"
고려산업,"배합사료,플라스틱용기 제조/부동산 임대","곡물가공품, 전분 및 전분제품 제조업","기업개요
동사는 1957년 고려건설주식회사로 설립되어 1991년 유가증권시장에 상장되었으며, 금강공업 기업집단에 속해있음.
가축용 배합사료의 제조 및 판매를 주업종으로 하고 있으며, 배합사료의 안정적인 판로확보와 함께 축산물 유통 노하우 축적을 위해 식육사업부문(기타부문)을 운영함.
미국, 남미 등으로부터 옥수수, 대두박 등 제품생산에 필요한 원재료를 수입하고 있으며, 부산,대구,창녕 사업장에 배합사료 생산공장을 보유하고 있음.
출처 : 에프앤가이드"
농심홀딩스,"지주회사,투자자문,경영컨설팅 서비스",기타 금융업,"기업개요
동사는 2003년 7월 1일에 주식회사 농심의 투자사업부문이 인적분할되어 자회사에 대한 지배와 투자 및 업무지원을 목적으로 하는 지주회사로 설립되었음.
주요 자회사 및 종속회사는 농심, 율촌화학, 태경농산, 농심개발, 농심엔지니어링이 있음.
특히 농심 국내 식품업계 대표기업을 넘어 글로벌 식문화 선도기업으로 성장하고 있으며, 면류, 스낵, 음료 등의 판매를 주사업으로 하고 있음.
출처 : 에프앤가이드"
대한제분,"소맥분,토코밀,프리믹스,밀가루조제품,제분부산물 제조/파스타 수입,판매","곡물가공품, 전분 및 전분제품 제조업","기업개요
동사는 소맥분 제조 및 판매 등을 영위할 목적으로 1953년 설립되어 주요 사업으로는 소맥분 제조 및 판매, 사료 제조 및 판매, 하역 및 보관, 반려동물사업, 식음료 판매 등이 있음.
주요 제품으로는 소맥분, 프리믹스, 각종 사료(양돈, 양계, 축우, 양견, 양어), 반려동물 사료, 커피 및 기타음료, 베이커리/멕시칸푸드 등이 있음.
'곰표'는 동사가 설립된 이후 약 70년 함께한 상표로서 현재도 밀가루의 대명사로 자리매김.
출처 : 에프앤가이드"
사조동아원,"제분, 배합사료 제조","곡물가공품, 전분 및 전분제품 제조업","기업개요
동사와 연결종속회사들의 사업부문은 제분부문, 생물자원부문, 기타부문으로 구별됨.
연결실체인 사조동아원는 원맥을 수입 ·가공하여 판매하는 제분사업부문과 가축 및 양식어류의 사료를 제조 ·판매하는 생물자원사업부문을 주요사업으로 영위하고 있음.
경영효율성 증대 및 시너지효과를 극대화 하고자 2017년 기존 최대주주인 한국제분 주식회사를 흡수합병하여 제분사업부문을 통합함.
출처 : 에프앤가이드"
