Company,items,industry,description
MH에탄올,"주정,탄산가스 제조",알코올음료 제조업,"기업개요
동사는 1978년 7월 설립되었으며 사업부문은 주정의 제조 및 판매를 하는 주정 사업부, 기계설비 및 제작 사업부, 골프장 사업부로 구성됨.
주정업계는 9개사의 주정제조 회사가 있고 생산된 제품은 대한주정판매가 대부분을 구매한 후 주류 제조 회사와 식품제조 회사 및 제약회사 등에 판매함.
동사가 영위하고 있는 퍼블릭 골프장은 회원을 모집하지 않고 예약에 의해 누구나 이용할 수 있으며 이용요금도 저렴하다는 특징이 있음.
출처 : 에프앤가이드"
모나리자,"화장지,미용티슈 제조,도매",기타 종이 및 판지 제품 제조업,"기업개요
동사는 화장지 제조 판매, 지류 제조, 일용 잡화의 판매업을 영위하며 또한 위생용품 제조 및 판매업과 각 사업 부문에 관련된 부대 사업을 영위하고 있음.
화장지를 제조하는 동사와, 화장지 제조, 화물자동차 운송, 상품중개, 무역, 인적관리용역, 위생용품 제조를 영위하는 7개의 관계회사가 있음.
종이 사용분야에 따라 문화용지, 산업용지, 위생용지, 특수지 등으로 구분되고 있음.
출처 : 에프앤가이드"
선진,조제동물사료,동물용 사료 및 조제식품 제조업,"기업개요
동사는 배합사료 제조 및 판매업, 축산물 가공 및 판매업 등을 영위할 목적으로 설립되었으며 2011년 1월에 동사와 선진지주로 인적분할함.
동사의 주된 사업은 배합사료 제조 및 판매업이며 그밖에도 축산물 가공 및 판매업, 양돈업 등을 영위하고 있음.
농장직접방문 또는 세미나 개최를 통해 사양, 방역, 급여지도 등 고객이 원하는 최고의 품질의 제품 및 서비스를 제공하여 매출을 확대하고 있음.
출처 : 에프앤가이드"
오뚜기,"라면,마요네즈,카레,스프,당면,소오스,토마토케첩,마가린,냉동생지(바게트,크로와상),참치캔,식초,3분짜장 제조",기타 식품 제조업,"기업개요
동사와 그 종속기업(이하 '연결회사')는 건조식품, 양념소스, 유지, 면, 농수산 가공식품 등 다양한 종류의 식품을 국내/외 주요 사업장에서 제조 및 판매를 영위함.
현재 안양, 대풍, 삼남, 포승 등에 제조시설을 갖추고 있으며, 각 종속기업들은 파주, 음성, 고성 등에 제조시설을 기반으로 사업을 영위.
해외 사업장으로는 미국, 베트남, 뉴질랜드, 중국 등으로 판매/제조시설을 운영하고 있음.
출처 : 에프앤가이드"
오리온,스낵 등 과자류,기타 식품 제조업,"기업개요
2017년 6월 인적분할로 설립되었으며 음식료품의 제조, 가공 및 판매사업을 주요 사업으로 영위함.
국내 시장에서는 초코파이를 위시한 여러 파이 제품과 포카칩, 오징어땅콩 등의 안정적인 실적을 바탕으로 매년 다양한 신제품을 출시해 성공시키며 높은 시장 지배력을 보이고 있음.
해외 시장에서는 중국 시장을 중심으로 큰 성장을 이루어내고 있으며, 소매점 판매강화를 통해 지역 및 채널망을 확장시켜 나가고 있음.
출처 : 에프앤가이드"
카나리아바이오,"양계, 양돈 배합사료",동물용 사료 및 조제식품 제조업,"기업개요
동사는 주요 사업으로 바이오사업 및 사료사업을 영위하고 있음.
동사가 추진하는 바이오생명공학 사업은 난소암, 췌장암 및 전이성 유방암 관련 면역항암치료제 관련 연구자산, FDA 임상 스폰서십자격 및 특허권 등의 지적 자산을 토대로 면역항암치료제를 개발, 생산하는 것을 골자로함.
배합사료 제조판매업을 주업으로 수행하고 있으며 그 중 주요 판매 제품은 양계사료와 양돈사료가 있음.
출처 : 에프앤가이드"
푸드웰,"깐밤, 통조림류, 딸기시럽류, 음료제품 등","과실, 채소 가공 및 저장 처리업","기업개요
동사는 음식료품의 제조 및 도소매, 수출입을 영위하는 기업으로 주요 제품군은 시럽제품군, 음료제품군, 밤제품군을 보유하고 있음.
시럽제품군과 음료제품군의 경우 주로 1차 원료 가공 생산 및 대기업의 OEM방식으로 제품을 생산하며 밤제품의 경우 국내산 밤을 수매하여 제조,가공후 일본등지로 수출함.
자회사인 청도푸드웰식품유한공사는 농,임산물 생산가공 및 판매를 주 사업목적으로 함.
출처 : 에프앤가이드"
한국맥널티,커피 및 의약품,기타 식품 제조업,"기업개요
1997년 12월 설립되었으며, 생두에서부터 원두커피 가공제품까지 커피와 관련된 전반적인 사업 전체를 영위함.
인스턴트 커피부터 RTD 제품까지 전제품의 라인업을 확보하고 있으며, 동종업계 내 유일하게 대형 유통채널에서부터 슈퍼, 편의점, 온라인 등에 제품을 공급함.
원료의약품을 구매하여 소비자가 복용할 수 있는 형태의 완제의약품을 제조하여 공급하고 있으며 일반 의약품 및 전문 의약품을 모두 생산, 판매함.
출처 : 에프앤가이드"
CJ씨푸드,"수산물(어묵,맛살)가공품 도매,원양수산업,수출입",기타 식품 제조업,"기업개요
동사는 1976년 삼호물산 주식회사로 설립되어, 1985년 삼호어묵을 출시하면서 내수식품사업을 시작.
주요 사업 내용은 어묵, 맛살, 햄, 김 등을 생산 판매하는 식품사업이며 CJ제일제당의 중앙연구소와 연계된 최고의 품질관리시스템을 통해 고객이 안심하고 먹을 수 있는 우수한 먹거리를 제공.
소비자의 건강에 대한 지속적인 관심도 증가와 Well-being 변화에 맞춘 신제품 개발을 적극 추진해 왔으며, 판매영역을 확대함.
출처 : 에프앤가이드"
CJ제일제당,"설탕,소맥분,조미식품,육가공식품(돈육,돼지비계,돼지식용설육),대두가공식품,사료,의약품,생활화학제품 제조,도매,무역/통신판매",기타 식품 제조업,"기업개요
2007년 9월 CJ에서 기업 분할되어 식품과 생명공학에 집중하는 사업회사로 출발한 국내 1위 식품회사의 위치를 공고히하고 있음.
고급화 되어가는 소비자 트렌드에 맞춰 프리미엄화 전략을 적극 추진하여 뛰어난 맛과 품질, 강력한 브랜드 파워를 갖추기 위해 노력 중임.
육상 및 해상 등 여러 분야에서 전국 네트워크 구축을 통해 운송의 합리화를 추진하여 물류 품질의 질적 향상과 서비스 극대화에 중점을 두고 있음.
출처 : 에프앤가이드"
농심,"라면,스낵,유지 제조,도매,수출입",기타 식품 제조업,"기업개요
동사는 면류, 스낵, 음료 등의 판매를 주사업으로 하며 브랜드 파워, 연구개발 역량, 생산 및 품질, 경영능력 면에서 세계적인 경쟁력을 갖추고 있음.
전 세계 100여 개 국가에 주요 제품을 수출하고 있으며, '농심 아메리카', '상하이 농심푸드' 등 주요종속회사들과 시너지 효과를 냄.
백산수를 먹는샘물 분야의 브랜드로 육성 중이며, 국내외 수요 확대에 대비하여 생산능력을 대규모로 확충.
출처 : 에프앤가이드"
동원F&B,"참치캔,음료,냉동식품 제조,판매",기타 식품 제조업,"기업개요
동사는 일반식품부문, 조미유통부문, 사료부문, 온라인사업부문으로 구성되어 있음.
동사의 일반식품은 동원 브랜드의 참치캔 등, 양반 브랜드의 조미김 등, 덴마크 등 유가공제품, 리챔의 육가공제품, 다양한 소스류와 사료사업 등으로 확장해왔음.
코로나 19의 영향으로 인해 온라인시장이 꾸준히 상승추세를 보이고 있음. 이는 물류산업의 발전과 소비자 행동의 변화에 따른 것으로 합리적이고 편리함을 갖춘 온라인 시장의 지속적인 성장이 예상됨.
출처 : 에프앤가이드"
무학,소주,알코올음료 제조업,"기업개요
동사는 부산, 경남, 울산을 대표하는 주류제조 및 판매 기업으로 동남권 지역에서 주력상품인 순한 소주 '딱좋은데이' 및 '화이트소주'로 소주시장에서 주요 위치를 차지하고 있음.
지역밀착 경영을 통한 높은 점유율을 유지관리하고 있으며, 매실마을, 국화면좋으리와 같이 지역 특산물을 이용한 주류의 개발과 상품화로 지역과의 동반성장을 위해 노력함.
미국과 일본 등지에서 꾸준한 수출 실적 상승으로 이어가고 있음.
출처 : 에프앤가이드"
보락,"식품향료,식품첨가물,화학제품,껌베이스(자일리톨,에리스리톨),담배향료 제조,판매",기타 화학제품 제조업,"기업개요
동사는 1959년 한국농산공업(주)로 설립되었으며, 사업다각화에 따라 주식회사 보락으로 상호를 변경함.
식품첨가물사업 및 원료의약품사업 등을 주요 사업으로 영위하고 있으며, 상품의 매출과 기타(임가공 외)사업을 영위하고 있음.
식품향료, 껌베이스, 생약제, 식품기능성 소재, 천연화장품 신소재 개발 등 최근 트렌드에 맞는 시장의 흐름을 파악하여 제품을 개발하는데 중점을 두고 연구개발을 통해 꾸준히 신제품을 출시중임.
출처 : 에프앤가이드"
빙그레,"아이스크림,우유,스낵,유산균(욥닥터캡슐) 제조",낙농제품 및 식용빙과류 제조업,"기업개요
동사의 사업부문은 유가공 단일 부문으로 구성되어 있으며, 온도대별로 냉장품목군과 냉동 및 기타품목군으로 이루어져 있음.
동사의 주요 제품으로는 '바나나맛우유', '요플레', '투게더', '아카페라', '따옴' 등이 있으며, 종속회사인 해태아이스크림의 주요 제품으로 '부라보콘’ 등이 있음.
동사의 판매전략은 품목 대형화 및 집중화, 직거래 영업 활성화, 영업력 강화이며, 매년 꾸준한 연구개발 투자로 다양한 신제품을 개발하고 있음.
출처 : 에프앤가이드"
사조대림,"게맛살,어육연제품,식용류,배합사료 제조",수산물 가공 및 저장 처리업,"기업개요
동사는 1964년 설립되어 식품, 식용유 제조 및 판매업과 원양어업을 주요 사업으로 하는 회사로, 1976년 유가증권시장에 상장함.
동사와 연결종속회사들의 주요사업부문은 식품사업부문, 축산사업부문, 수산사업부문으로 구분되고 있으며, 총 5개의 종속회사로 구성되어 있음.
수산부문은 세계 최다 횟감용 참치선단을 보유한 사조그룹과 수산부문을 통합함으로써 트롤분야 업계 1위의 자리를 확고히 함.
출처 : 에프앤가이드"
신송홀딩스,사업경영 및 관리자문,산업용 농·축산물 및 동·식물 도매업,"기업개요
동사는 2010년 6월 부로 '신송식품홀딩스'를 흡수합병하면서 존속회사는 '신송홀딩스'로 상호를 변경하여 현재 지주회사 체제로 전환함.
동사는 순수지주회사로서 보고서 작성 기준일 현재 해외법인을 포함하여 4개의 자회사(신송식품,신송산업,Singsong (HK), Singsong Global Singapore Pte) 보유함.
투자사업부문, 식품사업부문, 해외사업부문, 투자부동산부문, 소재수업부문 등이 있음.
출처 : 에프앤가이드"
조흥,"휘핑크림,인스턴트이스트,프루츠칵테일,크림치즈,견과류,건조과일 제조,판매/주택 신축,판매",기타 식품 제조업,"기업개요
동사는 1959년 설립되어 주력으로 삼아오던 화학제품의 생산을 중단한 뒤, 현재는 식품 및 식품첨가물을 제조하고 있음.
치즈 및 기타 식품첨가물의 제조 및 판매사업을 영위하고 있으며, 동사 제품 및 상품 매출은 모두 국내에서 이루어지고 있음.
치즈가공 사업은 치즈의 쓰임새가 다양한 식품의 원재료로 쓰이고 있어 수요가 계속 증가하는 추세이며 안정적인 발전이 기대되는 분야임.
출처 : 에프앤가이드"
하이트진로,소주,알코올음료 제조업,"기업개요
동사의 영업부문은 맥주사업, 소주사업, 생수사업 및 기타사업부문으로 구성되어 있으며, 이 중 맥주사업과 소주사업이 매출의 상당 부분을 차지하고 있음.
맥주 부문의 주요 제품으로 2019년에 출시한 청정라거-테라가 있으며, 2023년 3월 기준 37억병 판매를 돌파하였고 4월 올몬 맥주 켈리를 출시함.
소주 부문은 대한민국 대표 소주 '참이슬'과 소주 시장에 새로운 바람을 일으키고 있는 '진로' 가 국내 소주시장을 리딩함.
출처 : 에프앤가이드"
TS트릴리온,기업인수합병,기타 화학제품 제조업,"기업개요
탈모시장을 타겟으로 하여 헤어케어, 피부관리 등 안티에이징 제품 등을 제조/판매하는 사업을 영위하고 있음.
3대 홈쇼핑사에서 제공한 2019년 이미용 히트상품 분석자료에서 탈모샴푸 부문과 일반 샴푸 부문에서 TS샴푸가 1위를 차지함.
지속적인 R&D 및 제품 라인 확장, 글로벌 광고 및 마케팅 집행, 오프라인 유통 채널 확보를 통해 사업을 확장해나갈 계획임. 2020년 12월 30일 스팩합병을 통해 코스닥시장에 이전상장함.
출처 : 에프앤가이드"
매일홀딩스,유제품,낙농제품 및 식용빙과류 제조업,"기업개요
분할전 회사는 지주회사 체제 전환을 위해 2017년 5월 자회사 지분의 관리 및 투자를 목적으로 하는 투자사업부문과 기존의 유가공 제조 및 판매를 담당하는 유가공사업부문으로 인적 분할함.
지주회사인 동사와 유가공사업을 영위하는 매일유업, 음료점 및 음식점업을 영위하는 엠즈씨드, 크리스탈제이드코리아가 종속회사로 있음.
또한 유통 및 서비스업을 영위하는 엠즈푸드시스템, 상하낙농개발, 상하농어촌테마공원을 종속회사로 보유함.
출처 : 에프앤가이드"
보라티알,"유가공품, 소스류, 파스타류",음·식료품 및 담배 도매업,"기업개요
2015년 인적분할로 설립되어 파스타, 올리브오일, 토마토소스 등 가공식품을 수입하여 유통하는 식자재 수입 유통 전문기업.
이탈리아, 스페인 등의 40여개 가공식품 제조사로부터 720여 가지의 식자재들과 식료품들을 수입, CJ 프레시웨이, 신세계푸드 등 국내 총 1,900여개 업체에 공급.
이태리 식자재 분야의 선두주자로서 다년간 축적된 레시피 등을 바탕으로 신규사업인 HMR 식품 사업을 추진하고 있음.
출처 : 에프앤가이드"
전진바이오팜,"방충방향제, 유해동물피해감소제, 기생충피해감소제",기타 화학제품 제조업,"기업개요
동사는 2004년 9월에 설립되어 천연유래소재로 이루어진 라이브러리를 구축하고 이를 이용하여 유해생물에 의한 피해를 예방, 방지하는 피해감소제 사업을 영위하고 있음.
이러한 라이브러리를 이용하여 생활용품 제품, 동물용품들로 확장함.
생활용품 사업군, 동물용품 사업군으로 사업영역을 확장하는 한편, 신규사업 부문인 기생충(Sea Lice) 피해감소제를 연구개발하여 상용화를 추진하고 있음.
출처 : 에프앤가이드"
커머스마이너,"건강기능식품, 블랙박스, 내비게이션 등",상품 종합 도매업,"기업개요
2011년 1월 전자제품 부품 개발, 제조 및 판매를 주사업 목적으로 설립되었으며 현재 주력 사업은 스마트카 부문임.
임베디드 소프트웨어 기술 중 비전엔진 기술에 특화되어 있으며 해당 기술은 스마트카, 스마트 홈, 웨어러블 디바이스, 드론 등 다양한 분야로 응용이 확대되고 있음.
2017년 4월 AR 오픈소스 플랫폼 '글림스(Glimpse)'를 전세계 최초로 공개한 바 있음.
출처 : 에프앤가이드"
케이씨피드,사료,동물용 사료 및 조제식품 제조업,"기업개요
동사는 1970년 5월 경북축산주식회사로 설립되었으며 1995년 6월에 코스닥시장에 상장함.
배합사료 제조업을 주사업목적으로 실립되었으며, 2017년 농업회사법인 케이씨프레쉬를 흡수합병하여 배합사료 생산·공급, 거래 농가의 계란 구입, 액란 제조 판매 사업을 영위 중임.
비료기술과 노하우를 가진 일본회사와 컨설팅을 2020년 2월까지 진행, 비료생산업 등록 후 가축분퇴비인 '봉선화'를 출시하여 판매중에 있음.
출처 : 에프앤가이드"
하림,"육계, 육계가공식품","도축, 육류 가공 및 저장 처리업","기업개요
동사는 2011년 사업부문 중 육계가공 및 사료제조업 등 사업부문 일체를 단순 인적 분할하여 신설된 회사임.
주요 사업으로 양계 및 양계 가공업, 사료제조업을 영위하고 있으며, 동 위탁 사육, 부화, 종계업, 농산, 수산, 축산판매사업을 수행하고 있음.
종속회사인 HBC는 원종계, 종계 사육을 통한 종란을 생산하고 하림애니멀클리닉은 동물성 의약품 도소매를 담당함.
출처 : 에프앤가이드"
흥국에프엔비,"과일음료(에이드베이스, 스무디, 착즙쥬스 등)",비알코올음료 및 얼음 제조업,"기업개요
2008년 3월 설립되어 청량음료, 영양식품, 과즙음료, 과실, 기타 식품첨가물 등의 제조 및 판매를 주요 사업으로 영위하고 있으며, 과일농축액은 시장의 선도자로서 독보적인 시장지위 및 브랜드 인지도를 확보.
해외에서 수입하는 주요 원재료인 오렌지, 레몬, 청포도 등의 원과와 퓨레 등은 자회사인 모닝듀에프엔비를 통해 직접 수입 및 대행하고 있음.
업계 유일의 동결농축 공정을 음료제조에 접목하여 비열처리 커피·비커피 제품을 생산함.
출처 : 에프앤가이드"
동서,"식품 유통, 다류 및 연포장재 제조 등",음·식료품 및 담배 도매업,"기업개요
동사는 1975년 5월 16일에 설립돼 1995년 12월 27일에 코스닥시장에 상장한 바 있으며, 이후 상장폐지한 후 2016년 7월 15일 유가증권시장에 신규 상장함.
식품사업, 포장사업, 다류사업, 수출ㆍ입 및 구매대행업 등을 주요 사업으로 영위하고 있음.
원료의 재배부터 생산, 출하까지 정밀 분석기기를 도입 운영하여 유해물질의 제품 혼입을 원천적으로 예방 관리하고 있음.
출처 : 에프앤가이드"
동원산업,지주회사,기타 금융업,"기업개요
동사는 2022년 동원엔터프라이즈와의 합병을 통해 동원그룹의 지주회사가 되었으며 동사의 지주부문 영업수익은 계열회사에 대한 용역서비스 매출 및 상표권 사용수익 그리고 IT부문 매출 등으로 구성되어 있음.
동사는 PS/ST 생산용 선망선과 PS 생산용 참치 선망선에서 횟감용 참치를 생산함으로써 부가가치를 증대함.
주력 자회사들이 전반적으로 안정된 사업기반을 바탕으로 양호한 영업실적을 유지하고 있음.
출처 : 에프앤가이드"
동원수산,"원양어업/수산물 제조,가공/참치어류 냉동냉장업",어로 어업,"기업개요
동사는 1970년 5월 5일 설립되었으며, 1996년 11월 22일 한국거래소에 상장됨.
창업 후 현재까지 어업 및 식품가공, 수산물 유통 등의 수산분야에 매진해온 전통 있는 기업임. 16척의 원양어선을 보유 중.
상장 후에도 뉴질랜드와 중국등지에 현지법인을 설립하고, 참치 가공전문 자회사를 설립하는 등 더욱 전문화된 수산전문기업으로 발돋움 하기위해 노력을 경주하고 있음.
출처 : 에프앤가이드"
롯데웰푸드,"껌,캔디,초코,비스켓,빙과",기타 식품 제조업,"기업개요
인적분할로 설립되어 2017년 10월 재상장하였으며 식품 제조, 가공, 판매 및 수입 판매업 등을 주요 사업으로 영위.
주요 제품으로는 빼빼로, 마가렛트, 꼬깔콘 등이 있으며 껌과 초콜릿 분야에서는 자일리톨, 가나와 같은 브랜드로 시장을 선도.
34개사를 종속회사로 두고 있으며 식품제조판매 회사인 Chocolaterie Guylian N.V, Lotte Kolson(Pvt.) Limited 등이 포함되어 있음.
출처 : 에프앤가이드"
마니커,"닭고기,햄,계육가공제품,계육,육가공제품 제조,판매,유통/양계관련사업/부동산임대/수출입대행","도축, 육류 가공 및 저장 처리업","기업개요
동사는 1985년 9월 27일 계육 제품의 생산 및 판매를 목적으로 설립되었으며, 2002년 10월 29일 유가증권시장에 상장함.
최근 사회적인 웰빙 식생활 문화의 흐름에 발맞춰 동사는 다양한 기능성 제품을 개발하는 한편 손쉽고 간편하게 즐길 수 있는 제품 등을 출시하고 있음.
수입개방의 환경 가운데서도 국산 냉장 닭고기와 수입 냉동 닭고기의 질적인 면에서의 차이로인하여 육계산업은 꾸준히 성장할 것으로 예상하고 있음.
출처 : 에프앤가이드"
사조씨푸드,횟감용 참치 및 기타 일반수산물,수산물 가공 및 저장 처리업,"기업개요
동사는 1980년 사조냉장으로 설립되어 수산물 도매업을 시작으로, 현재는 참치 어획에서부터 유통, 수출, 부가식품 개발 및 판매를 책임지는 수산물 가공 유통전문기업임.
횟감용 참치의 국내 가공은 현재 동사를 비롯한 동원산업, 유왕, 정필 등 소수 업체가 전체 시장점유율 90% 이상을 차지하고 있으며, 국내 연간 총 가공 규모는 약 5만톤으로 추산됨.
주요 수출국은 일본이며 북미, 유럽시장으로의 수출 확대에도 노력 중임.
출처 : 에프앤가이드"
삼정펄프,"지류화장지,안면용,위생용 티슈 제조,판매","펄프, 종이 및 판지 제조업","기업개요
동사는 화장지, 위생지, 기타 지류의 제조 및 판매를 주요 사업으로 영위하고 있음.
2008년부터 완제품 활성화 전략으로 제품을 개선하고 2009년 5월에는 ""그루""를 출시하여 고급 제품 시장에서 차별화를 통한 경쟁력을 강화하였음.
안양 부지를 활용한 물류 시스템을 구축함으로써 현재 두 단계의 배송절차를 간소화, 효율화 시켜 일반관리비 등 비용과 시간을 절감하고 있음.
출처 : 에프앤가이드"
샘표식품,간장,기타 식품 제조업,"기업개요
동사는 2016년 7월 1일 샘표로부터 인적분할 되어 식품 제조, 가공 및 판매를 담당하는 식품사업부문을 영위.
간장, 된장, 고추장 등 전통 장류부터 요리에센스 연두, 프리미엄 서양식 폰타나, 원물간식 질러 등 다양한 음식료를 제조, 판매.
'폰타나(fontana)'라는 독립 브랜드를 도입하여 엄선한 원료로 세계 각국의 정통 요리법을 구현, 브랜드 인지도 확대를 통한 매출 증가 추세.
출처 : 에프앤가이드"
우성,"배합사료,Suit-feed(맞춤 TMR(육성우,건유우,착유우) 사료),농후사료,곡류(강피류 등 부산물) 제조,판매/부동산 임대,무역","곡물가공품, 전분 및 전분제품 제조업","기업개요
동사 및 종속기업은 배합사료 전문 업체로 가축용 배합사료 및 양어, 반려동물 사료의 제조, 판매업을 영위하고 있음.
고품질, 친환경 배합사료 제품의 생산 및 고수익형 사업구조 구축을 위해 국내외 유수의 연구기관과의 컨설팅 계약 등을 체결함.
주요 매출경로는 축산업자 및 양식업자 등 사양가와의 직거래로 이루어지며, 대리점 및 농/축협 등을 통해서도 활발한 영업활동이 이루어지고 있음.
출처 : 에프앤가이드"
팜스코,"배합사료 제조,도매","곡물가공품, 전분 및 전분제품 제조업","기업개요
동사는 1999년 10월 1일 자본금 60억원으로 설립되었고, 1999년 10월 25일 한국증권거래소에 시장2부종목으로 상장함.
동사는 주된 사업은 배합사료업을 주업으로 하고 있으며 이 밖에도 신선식품 판매 및 도축업, 육가공, 양돈업, 태양광, 퇴비화 사업 등도 수행중임.
신선식품 사업의 원료돈은 국내에서 조달하고 있으며, 본인이 직접 사육한 가축을 사용하거나 농가에서 사육한 가축을 구매하여 조달하고 있음.
출처 : 에프앤가이드"
해태제과식품,"홈런볼, 오예스, 맛동산, 부라보콘 등",기타 식품 제조업,"기업개요
동사는 제과전문그룹 크라운해태홀딩스에 소속된 계열회사로 식품 제조, 가공, 판매 및 수입 판매하는 종합제과기업임.
제과 제품으로는 홈런볼, 맛동산, 오예스, 에이스 등의 주력제품이 있고 냉동식품으로는 고향만두가 시장에서 높은 점유율을 확보하고 있음.
과자, 냉동식품 등을 생산하며 전국적 영업조직망을 통해 다양한 유통경로로 최종소비자들에게 양질의 제품을 공급하고 해외시장 개척을 통해 글로벌식품회사로 성장 중임.
출처 : 에프앤가이드"
